{
  "schemaVersion": 1,
  "projectId": "01b5725c-2688-4cbc-bc29-7432712449b3",
  "contractRevision": "49.1-draft",
  "version": "49",
  "source": "v49-project-library-preview",
  "designSource": { "entry": "design/open-design/v2026-08-11-v49-clip-monitor-review/short-drama-material-studio-v49-clip-review.html", "sha256": "C95820F2FCE372E9BBA3A2A1062495D418951025C1A7C65A73429F5C0FFD563D" },
  "screen": "screen-clip",
  "state": "default-candidate-selected",
  "viewport": { "width": 1280, "height": 720 },
  "fixture": "原型：完整 V49 HTML 以 ?v49preview=default 固定 screen-clip；Electron：P0 隔离数据中真实 ASR 锚点生成的待确认候选与可读媒体。",
  "test": "tests/current/p0-workflows.spec.ts（FLOW-001 to FLOW-004）",
  "evidenceStatus": "accepted",
  "captures": {
    "projectPreview": { "path": "docs/design-evidence/v49/screen-clip/default-candidate-selected/1280x720/project-library-preview.png", "sha256": "25231E9A1A2A7305E6CF4F088AEAB7329BECAF469C6A5450E9FDF7561D40D148", "width": 1280, "height": 720 },
    "electron": { "path": "docs/design-evidence/v49/screen-clip/default-candidate-selected/1280x720/electron.png", "sha256": "1FE691D903328A976E6DE09ADBE11E50048599A06B83931A87EA8B124CAF3C48", "width": 1280, "height": 720 }
  },
  "allowedDifferences": ["真实媒体画面、PTS、候选 ID、候选与分集数量及其文本来自隔离真实数据。"],
  "comparisonRegions": [{ "label": "应用壳与页面头部", "x": 0, "y": 0, "width": 1280, "height": 160, "maxChangedPixelRatio": 0.04, "maxMeanRgbDelta": 3 }, { "label": "阶段导航", "x": 240, "y": 160, "width": 1010, "height": 52, "maxChangedPixelRatio": 0.1, "maxMeanRgbDelta": 5 }],
  "acceptance": { "status": "passed", "reviewer": "Codex same-viewport V49 visual acceptance", "reviewedAt": "2026-08-20T22:08:10+08:00", "notes": "人工逐态核对完整壳、页面坐标、三栏工作台、双时间线、候选检查器与滚动归属；受控差异见 allowedDifferences。" }
}
